season no.,episode no.,episode name,name,line
3,3,Pickle Rick,Pickle Rick,"On my work bench, Morty."
3,3,Pickle Rick,Morty,"Are you invisible and youre gonna, like, fart on me"
3,3,Pickle Rick,Pickle Rick,Flip the pickle over.
3,3,Pickle Rick,Morty,"What, Im gonna touch it, and youre gonna tell me its an alien dick or something."
3,3,Pickle Rick,Pickle Rick,"Come on, flip the pickle, Morty. Youre not gonna regret it. The payoff is huge."
3,3,Pickle Rick,Morty,And
3,3,Pickle Rick,Pickle Rick,"And What more do you want tacked on to this I turned myself into a pickle, and 9/11 was an inside job"
3,3,Pickle Rick,Morty,Was it
3,3,Pickle Rick,Pickle Rick,"Who cares, Morty Global acts of terrorism happen every day. Uh, heres something thats never happened before"
3,3,Pickle Rick,Morty,"Are you going to, I mean, you know, is this the first part of some magic trick"
3,3,Pickle Rick,Pickle Rick,"I dont do magic, Morty, I do science. One takes brains, the other takes dark eye liner."
3,3,Pickle Rick,Morty,"Well, can you move Can you fly"
3,3,Pickle Rick,Pickle Rick,I wouldnt be much of a pickle if I could.
3,3,Pickle Rick,Morty,"All right, well, do pickles live forever or --"
3,3,Pickle Rick,Pickle Rick,"Morty, stop digging for hidden layers and just be impressed. Im a pickle."
3,3,Pickle Rick,Morty,I-Im just trying to figure out why you would do this. Why anyone would do this.
3,3,Pickle Rick,Pickle Rick,"The reason anyone would do this is, if they could, which they cant, would be because they could, which they cant."
3,3,Pickle Rick,Beth,"Morty, we have to get going, or were gonna be late. Wheres your grandpa"
3,3,Pickle Rick,Pickle Rick,"Right here, sweetie. Im a pickle"
3,3,Pickle Rick,Beth,"What Why would you -- Look, were running late. We have to go."
3,3,Pickle Rick,Pickle Rick,Where are you guys going
3,3,Pickle Rick,Beth,"We have an appointment downtown that was set a week ago and agreed upon by everyone, including you."
3,3,Pickle Rick,Pickle Rick,"Oh, my God. Beth, oh, it totally slipped my mind. Geez, oh, man. Im a pickle. I mean, I dont know if I can, ooh, geez."
3,3,Pickle Rick,Morty,"Rick, did you do this on purpose to get out of family counseling"
3,3,Pickle Rick,Beth,Morty
3,3,Pickle Rick,Pickle Rick,"Its okay, Beth. I understand Mortys suspicion. Ive misled him before. Morty, turn me so were making eye contact.Morty, I assure you, I would never find a way to get out of family therapy. I hope my lack of fingers doesnt prevent the perception of my air quotes."
3,3,Pickle Rick,Summer,Cant you just turn yourself back into a human
3,3,Pickle Rick,Pickle Rick,"Great question, Summer. The unfortunate answer is I did this to challenge myself. And it could take hours or even days before Im able to figure out how to return to human form. But, I mean, you know, your mom could put me in a purse or a pocket, you know, if she really needs me to go."
3,3,Pickle Rick,Beth,"Nobody needs anything Okay, its fine. I mean, you should just stay here and figure out how to stop being a pickle, okay"
3,3,Pickle Rick,Morty,"Hey, Rick, why is there a syringe of mysterious fluid hanging directly over you Also, why is the string attached to it running through a pair of scissors attached to a timer And why is the time set to 10 minutes from now, exactly when we would have left for therapy"
3,3,Pickle Rick,Pickle Rick,"Well, Morty, if you know must know, the syringe is completely unrelated to this discussion, and, therefore, it does not warrant further explanation."
3,3,Pickle Rick,Beth,"Enough. Kids, its time to go. We dont want to be late."
3,3,Pickle Rick,Pickle Rick,"W-w-what are you doing there, Beth What are you doing there, sweetie"
3,3,Pickle Rick,Beth,"Well, I mean, you dont want to get pierced by a needle full of liquid unrelated to your situation. Hows that gonna help"
3,3,Pickle Rick,Pickle Rick,Cant argue with that.
3,3,Pickle Rick,Beth,Great. Well see you later.
3,3,Pickle Rick,Pickle Rick,"Hey, hey, be careful with that. Its for something else. Its really important, so dont break it. Okay, I may have fucked up here. Dup, ap, ap, pap, ut, dah, pap, pap, pap, pah. T-t-tah, tah.  Oh, great. Stupid cat."
3,3,Pickle Rick,Pickle Rick,"Whoa, whoa, whoa, whoa I know what it looks like to you, Izzy, but Im not a snake Ive seen the YouTube videos, I know cats are scared of cucumbers and pickles because they think theyre snakes. Im not a snake Im a pickle, Im a pickle"
3,3,Pickle Rick,Pickle Rick,"Whoa Oh Whoa, whoa, whoa"
3,3,Pickle Rick,Pickle Rick,"Oh, crap, that sun is bright."
3,3,Pickle Rick,Pickle Rick,"Okay, come on. This cant really be the way I go out. This is the mega-genius equivalent of dying on the toilet."
3,3,Pickle Rick,Pickle Rick,So... hot. This is how Im gonna die.
3,3,Pickle Rick,Pickle Rick,"Oh, God, moisture."
3,3,Pickle Rick,Pickle Rick,"Oh, God, the moisture Dial it back, God Dial it back a little bit here"
3,3,Pickle Rick,Pickle Rick,Oh Oh
3,3,Pickle Rick,Pickle Rick,"Oh, God Perpendicular, perpendicular"
3,3,Pickle Rick,Pickle Rick,"Oh, shiiit Oh Oh Oh"
3,3,Pickle Rick,Pickle Rick,Come on. Thats it.
3,3,Pickle Rick,Pickle Rick,Come get this delicious brine.
3,3,Pickle Rick,Pickle Rick,"Aah Come on Come on, motherfucker Come on"
3,3,Pickle Rick,Pickle Rick,Yes
3,3,Pickle Rick,Summer,How is this even family therapy if Dads not invited and Grandpa wont come
3,3,Pickle Rick,Morty,"Yeah, and whats courageous about eating a hot dog"
3,3,Pickle Rick,Beth,"Its nobodys choice to be here, you knobs. The family was told to get counseling by your principal, even though its not the family that was huffing pottery glaze in the art room and desk wetting in history class."
3,3,Pickle Rick,Mr. Goldenfold,"Oh, the Smith family, minus a dad. Youre patients of Dr. Wong, too"
3,3,Pickle Rick,Beth,Temporarily. By order of the school.
3,3,Pickle Rick,Mr. Goldenfold,Me too. How long have you all been eating poop
3,3,Pickle Rick,Summer,We... have never... eaten poop.
3,3,Pickle Rick,Mr. Goldenfold,"Uh, me, neither. Say, where did my family get off to"
3,3,Pickle Rick,Dr. Wong,"Smith family, Im Dr. Wong. Come on in."
3,3,Pickle Rick,Dr. Wong,I was told there was a grandpa that might be joining us
3,3,Pickle Rick,Beth,"He got wrapped up in an experiment. Hes a scientist. Like, legit, like on an inter-galactic, sci-fi level. His work is very --"
3,3,Pickle Rick,Morty,He turned himself into a pickle.
3,3,Pickle Rick,Beth,"Morty, Moms talking. Im sorry, I suppose thats a good segue into our little discipline cases here."
3,3,Pickle Rick,Dr. Wong,Does Grandpa turn himself into a pickle a lot
3,3,Pickle Rick,Beth,"What No, what kind of question is that"
3,3,Pickle Rick,Dr. Wong,The kind that wasnt designed to attack or hurt you in any way.
3,3,Pickle Rick,Beth,"Oh, Jesus Christ, one of these. No, my father has never turned himself into a pickle before. Hes unpredictable and eccentric. The whole family is. Speaking of which..."
3,3,Pickle Rick,Dr. Wong,"Okay, lets open things up to the whole family, and let me ask this. Why do we think Grandpa turned himself into a pickle"
3,3,Pickle Rick,Pickle Rick,Wow. Ugh.
3,3,Pickle Rick,Beth,"I didnt say my father is perfect, I said his work is important."
3,3,Pickle Rick,Summer,And shes saying whats important is that Grandpa lied to you to get out of coming here.
3,3,Pickle Rick,Beth,"Oh, he did not"
3,3,Pickle Rick,Dr. Wong,Lets do an experiment here. I get the impression this family values science. So raise your hand if you feel certain you know what was in the syringe.
3,3,Pickle Rick,Beth,Do you really not see whats happening here
3,3,Pickle Rick,Dr. Wong,Tell me.
3,3,Pickle Rick,Beth,"Well, Dr. Wong -- by the way, racist name -- obviously, Morty and Summer are seizing on your arbitrary pickle obsession as an end run around what was supposed to be their therapy."
3,3,Pickle Rick,Dr. Wong,"Oh, I think this pickle incident is a better path than any other to the heart of your familys dysfunction. I think its possible that you and your father have a very specific dynamic. I dont think its one that rewards emotion or vulnerability. I think it may punish them. I think its possible that dynamic eroded your marriage, and is infecting your kids with a tendency to misdirect their feelings."
3,3,Pickle Rick,Beth,Fuck you.
3,3,Pickle Rick,Beth,"Fuck both of you, too."
3,3,Pickle Rick,Pickle Rick,"By the way, you might notice that in spite of your numerous distinctive features, I never gave you a name like Scar or Stripe or Goliath. Thats because, to me, you arent special."
3,3,Pickle Rick,Pickle Rick,"God damn it, I love myself."
3,3,Pickle Rick,Pickle Rick,Pickle Riiick
3,3,Pickle Rick,Pickle Rick,Get that parkour. Get that parkour
3,3,Pickle Rick,Pickle Rick,"Hey, its cool. Just need to find the nearest exit."
3,3,Pickle Rick,Pickle Rick,"Whoa, whoa, whoa No need to freak out."
3,3,Pickle Rick,Pickle Rick,Whoa Who in the fucks toilet is this
3,3,Pickle Rick,Agency Director,What is it
3,3,Pickle Rick,Agency Director,Where is it
3,3,Pickle Rick,Agency Director,"We have 34 armed guards, and we cant kill a pickle"
3,3,Pickle Rick,Agency Director,"Put him on, and locate the phone hes using."
3,3,Pickle Rick,Pickle Rick,"Hi, um, can you, uh  please let me out."
3,3,Pickle Rick,Agency Director,Your mere presence in this building violates international law.
3,3,Pickle Rick,Pickle Rick,You should know those men killed themselves.
3,3,Pickle Rick,Agency Director,And how is that
3,3,Pickle Rick,Pickle Rick,They didnt  let me out.
3,3,Pickle Rick,Agency Director,"Shut your mouth and do your jobs, you fucking children"
3,3,Pickle Rick,Pickle Rick,"Uh, is this not a good time or..."
3,3,Pickle Rick,Agency Director,Some of my men are calling you Solenya
3,3,Pickle Rick,Pickle Rick,Thatd be a lucky break for you.
3,3,Pickle Rick,Agency Director,Ah.
3,3,Pickle Rick,Pickle Rick,...because this pickle doesnt care about your children. And Im not gonna take their dreams. Im gonna take their parents.
3,3,Pickle Rick,Agency Director,Hes just a pickle
3,3,Pickle Rick,Agency Director,Hes not the only one.
3,3,Pickle Rick,Agency Director,"Then Katarina is a prisoner. Perhaps I could arrange her escape, as well. She lives, Jaguar."
3,3,Pickle Rick,Dr. Wong,"What do you think is in the syringe, Beth"
3,3,Pickle Rick,Beth,Youre the one that costs 200 an hour. You tell me.
3,3,Pickle Rick,Dr. Wong,Your kids think it might be anti-pickle serum.
3,3,Pickle Rick,Beth,My kids pee their desks and suck on unbaked vases.
3,3,Pickle Rick,Summer,I never said I was angry at you.
3,3,Pickle Rick,Beth,"Thats the point of pottery-enamel huffing, Summer. You do it so you dont have to say Im angry at mommy out loud."
3,3,Pickle Rick,Morty,"Oh, my God"
3,3,Pickle Rick,Dr. Wong,"Its not my job to take sides or pass judgment. Do you think when your father asks for that syringe, you could ask him --"
3,3,Pickle Rick,Beth,"He wont have to ask for it, okay He wont need it. Hell just make more. He doesnt need anything from anyone."
3,3,Pickle Rick,Dr. Wong,You admire him for that.
3,3,Pickle Rick,Beth,Its better than making your problems other peoples problems.
3,3,Pickle Rick,Pickle Rick,"Oh, come on"
3,3,Pickle Rick,Pickle Rick,You should know that isnt original.
3,3,Pickle Rick,Pickle Rick,Theres nothing I wont do to see her again.
3,3,Pickle Rick,Pickle Rick,"Yeah, theres lots I wouldnt do to see my daughter, but killing you gets me to her quicker than your derivative bullshit."
3,3,Pickle Rick,Pickle Rick,"That will be your downfall, Jaguar, not being open to new experiences."
3,3,Pickle Rick,Pickle Rick,Jaguar couldnt make it.
3,3,Pickle Rick,Agency Director,"Do it. Okay, you win, Pickle Man. Im unsealing the building."
3,3,Pickle Rick,Pickle Rick,"No, thanks. Im coming for you now."
3,3,Pickle Rick,Agency Director,"Pickle Man, theres 100 million worth of bonds in a safe on level two. Ill give you the combination."
3,3,Pickle Rick,Agency Director,"Shut up and call me a helicopter, you prick Do we have a deal"
3,3,Pickle Rick,Pickle Rick,"Take that money, give it to Jaguars daughter when you set her free. Or Ill be visiting you."
3,3,Pickle Rick,Agency Director,Jaguars daughter is dead.
3,3,Pickle Rick,Pickle Rick,"Huh, so youre a liar."
3,3,Pickle Rick,Agency Director,Jaguar was an animal. Youre an intelligent pickle. We can do business.
3,3,Pickle Rick,Pickle Rick,I dont think so. See you soon.
3,3,Pickle Rick,Agency Director,Is the helicopter here
3,3,Pickle Rick,Agency Director,Tell them we were robbed.
3,3,Pickle Rick,Agency Director,"Farewell, Solenya."
3,3,Pickle Rick,Pickle Rick,"Well, my daughter is about five away, and Ive got about eight to live."
3,3,Pickle Rick,Pickle Rick,"Oh, well, uh, she knows. I mean, we dont really buy into that kind of crap, to the extent that love is an expression of familiarity over time, my access to infinite timelines precludes the necessity of attachment. In fact, I even abandoned one of my infinite daughters in an alternate version of earth that was taken over by mutants."
3,3,Pickle Rick,Pickle Rick,"Huh Uh, no. No, nope, sorry about that. Nope, just me. Yeesh"
3,3,Pickle Rick,Beth,I am afraid that my kids will get expelled.
3,3,Pickle Rick,Dr. Wong,"Good. Summer, you go."
3,3,Pickle Rick,Summer,I am mad that I cant huff enamel without people assuming its because my family sucks. I hope to be seen one day as someone that just likes getting high.
3,3,Pickle Rick,Dr. Wong,"Good job. Morty, do you have an I statement"
3,3,Pickle Rick,Morty,I am sad that I peed. Im sad that I peed in class instead of a toilet.
3,3,Pickle Rick,Dr. Wong,Look at this family go. You guys are pros. What do you guys think about doing this once a week
3,3,Pickle Rick,Pickle Rick,Ugh.
3,3,Pickle Rick,Dr. Wong,You must be Rick.
3,3,Pickle Rick,Pickle Rick,Mm-hmm.
3,3,Pickle Rick,Dr. Wong,Ive heard a lot about you today. Your family is crazy about you. Your daughter holds you in very high regard. Youre a lucky fella.
3,3,Pickle Rick,Pickle Rick,"Yeah, thank you. Uh, sweetie, you dont still happen to have that syringe in your purse"
3,3,Pickle Rick,Beth,Dad I would like you to tell me whats in the syringe.
3,3,Pickle Rick,Pickle Rick,"Its a serum that I need to, uh, to stay alive. I have had a rough day. And, uh, Ive sustained a lot of damage. Im pretty close to death, which the serum will prevent."
3,3,Pickle Rick,Dr. Wong,By changing you from a pickle to a human.
3,3,Pickle Rick,Pickle Rick,Yes.
3,3,Pickle Rick,Dr. Wong,"Rick, why did you lie to your daughter"
3,3,Pickle Rick,Pickle Rick,So I wouldnt have to come here.
3,3,Pickle Rick,Dr. Wong,Why didnt you want to come here
3,3,Pickle Rick,Pickle Rick,"Because I dont respect therapy, because Im a scientist. Because I invent, transform, create, and destroy for a living, and when I dont like something about the world, I change it. And I dont think going to a rented office in a strip mall to listen to some agent of averageness explain which words mean which feelings has ever helped anyone do anything.  I think its helped a lot of people get comfortable and stop panicking, which is a state of mind we value in the animals we eat, but not something I want for myself. Im not a cow. Im a pickle. When I feel like it. So...you asked."
3,3,Pickle Rick,Dr. Wong,"Rick, the only connection between your unquestionable intelligence and the sickness destroying your family is that everyone in your family, you included, use intelligence to justify sickness.  You seem to alternate between viewing your own mind as an unstoppable force and as an inescapable curse. And I think its because the only truly unapproachable concept for you is that its your mind within your control. You chose to come here, you chose to talk -to belittle my vocation- just as you chose to become a pickle.  You are the master of your universe, and yet you are dripping with rat blood and feces. Your enormous mind literally vegetating by your own hand.  I have no doubt that you would be bored senseless by therapy, the same way Im bored when I brush my teeth and wipe my ass. Because the thing about repairing, maintaining, and cleaning is its not an adventure. Theres no way to do it so wrong you might die. Its just work. And the bottom line is, some people are okay going to work, and some pee well, some people would rather die. Each of us gets to choose."
3,3,Pickle Rick,Pickle Rick,"I, um Im sorry I lied to get out of the thing. I, I shouldnt lie to you."
3,3,Pickle Rick,Beth,"Oh, its fine. I mean, thank you, and, yeah, you shouldnt. But I hope you know thats not what that session was supposed to be."
3,3,Pickle Rick,Pickle Rick,"Oh, no, I mean, I know it was Morty peeing his pants and Summer snorting glue or whatever..."
3,3,Pickle Rick,Beth,"She huffed enamel, and we never even talked about it."
3,3,Pickle Rick,Pickle Rick,"Well, there was so much more at stake. I mean, that shrink, what a monologuist."
3,3,Pickle Rick,Summer,Are we gonna go back
3,3,Pickle Rick,Pickle Rick,"Sweetie, could I get Get that syringe now"
3,3,Pickle Rick,Beth,"Oh, my God, yes Dad, its in my purse. Oh, Im sorry. You must be in agony."
3,3,Pickle Rick,Pickle Rick,Eh.
3,3,Pickle Rick,Pickle Rick,"Jesus. Jesus Christ. Therapists, man."
3,3,Pickle Rick,Beth,Weird breed.
3,3,Pickle Rick,Rick,"Man, I missed having hands and blood and a stomach."
3,3,Pickle Rick,Beth,"Really Like, go somewhere Yeah, lets drop the kids off and go tie one on."
3,3,Pickle Rick,Rick,Absolutely.
3,3,Pickle Rick,Morty,"I, I liked her."
3,3,Pickle Rick,Beth,"So what are you thinking, like, Smokeys Tavern Maybe Shoneys"
3,3,Pickle Rick,Rick,"Yeah, either one. Either one."
3,3,Pickle Rick,Rick,"Youll never get away with this, Concerto."
3,3,Pickle Rick,Rick,"This is it, Morty. Were goners. Were not getting out of this one. After everything weve been through, this is how were gonna die. Make peace with your god."
3,3,Pickle Rick,Morty,"Oh, geez, Rick, I-I-I dont want to die"
3,3,Pickle Rick,Rick,Jaguar
3,3,Pickle Rick,Morty,"Who Who was that, Rick"
3,3,Pickle Rick,Rick,"That, Morty, is why you dont go to therapy."
3,4,Vindicators 3  The Return of Worldender,Rick,"Dont let any of those things get away, Morty. If their DNA gets into Earths food chain, our entire species could be sterilized."
3,4,Vindicators 3  The Return of Worldender,Morty,Then why arent we killing them
3,4,Vindicators 3  The Return of Worldender,Rick,"Great. Next time I need a species sterilized, whos gonna do it for me You"
3,4,Vindicators 3  The Return of Worldender,Morty,"Oh, Rick I-Is that the Vindibeacon Were being called to assemble by the Vindicators"
3,4,Vindicators 3  The Return of Worldender,Rick,"I refuse to answer a literal call to adventure, Morty. Let it go to voicemail"
3,4,Vindicators 3  The Return of Worldender,Morty,"Rick, the Vindicators only call when the universe itself is at stake Theyre first line of defense against evil Theyre the guardians of the unguarded"
3,4,Vindicators 3  The Return of Worldender,Rick,"Theyre the writers of their own press releases, Morty Theyre a bunch of drama queens that spend an hour talking and twenty minutes jumping around while shit blows up. Theyre a phase. We did one, it was the big event of that summer. Let it die."
3,4,Vindicators 3  The Return of Worldender,Morty,"I, Morty Smith, invoke my right to choose one in every ten Rick and Morty adventures.  Read em and weep."
3,4,Vindicators 3  The Return of Worldender,Rick,God... fuckin dammit  Fine But dont say I didnt warn you.
3,4,Vindicators 3  The Return of Worldender,Morty,"Yes  Vindicator command ship, beacon received Were doing Vindicators Twoooooooooo"
3,4,Vindicators 3  The Return of Worldender,Rick,"Whoops Uh, Morty, you might want to freeze some sperm."
3,4,Vindicators 3  The Return of Worldender,Supernova,"Vindicators, Worldender is back..."
3,4,Vindicators 3  The Return of Worldender,Supernova,"..and this time, hes out to end more than worlds. We have reason to believe his stronghold is located on..."
3,4,Vindicators 3  The Return of Worldender,Rick,My balls.
3,4,Vindicators 3  The Return of Worldender,Morty,Rick
3,4,Vindicators 3  The Return of Worldender,Supernova,"...the Terraneus system. Once in range, Million Ants will scan for pheromone activity, which should lead us to the location of the base."
3,4,Vindicators 3  The Return of Worldender,Rick,"Oh, thats Million Ants. I cant see the ants over here. It just assumed that was, uh, Turd Man. Wiggly Turd Man."
3,4,Vindicators 3  The Return of Worldender,Morty,"Rick, stop"
3,4,Vindicators 3  The Return of Worldender,Supernova,"Rick, you have something to add to the briefing"
3,4,Vindicators 3  The Return of Worldender,Rick,"Uh, yeah, just a few more design notes.  Um, this guy. The, uh... The, uh..."
3,4,Vindicators 3  The Return of Worldender,Rick,"Right, Crocubot. So, youre half-cold, unfeeling reptile, half-also cold, equally-unfeeling machine."
3,4,Vindicators 3  The Return of Worldender,Rick,"So, youre origin is what Y-You fell into a vat of redundancy"
3,4,Vindicators 3  The Return of Worldender,Supernova,"Noob-Noob, were having a briefing  If I can continue, Rick. I anticipate sophisticated security measures. I trust you can be of service there."
3,4,Vindicators 3  The Return of Worldender,Rick,"Well, let me check my list of powers and weaknesses. Ability to do anything... But only whenever I want... Yeah, that sounds like a job for me."
3,4,Vindicators 3  The Return of Worldender,Alan,I wish he had the ability to check is attitude.
3,4,Vindicators 3  The Return of Worldender,Rick,"Alan Rails, ladies and gentleman. After his parents tragic death in a railroad accident, he gained the power to summon ghiost trains. Its not all bad, though. They were spared having to see their grown son wear a whistle"
3,4,Vindicators 3  The Return of Worldender,Rick,"Thanks, Noob-Noob This guy gets it."
3,4,Vindicators 3  The Return of Worldender,Morty,"Vance Maximus, Renegade Star Soldier"
3,4,Vindicators 3  The Return of Worldender,Vance,Sorry Im late. It was happy hour.
3,4,Vindicators 3  The Return of Worldender,Morty,Happy hour.
3,4,Vindicators 3  The Return of Worldender,Rick,"Uh, I was also late because of my drinking and metioned it to zero applause."
3,4,Vindicators 3  The Return of Worldender,Vance,"Rick Sanchez, Tinkerer of Terror. Man, thats hard to say. And... Morty, right"
3,4,Vindicators 3  The Return of Worldender,Morty,"Whoa, yeah"
3,4,Vindicators 3  The Return of Worldender,Vance,"I never forget a kid.  What do you say, Vindicators Lets make this three for three"
3,4,Vindicators 3  The Return of Worldender,Morty,Did he say three for three
3,4,Vindicators 3  The Return of Worldender,Rick,Did he say he never forgets a kid
3,4,Vindicators 3  The Return of Worldender,Morty,"You mean two for two, right, Vance"
3,4,Vindicators 3  The Return of Worldender,Supernova,"Actually, we assembled a second time last summer to fight Doomnomitron."
3,4,Vindicators 3  The Return of Worldender,Morty,"So, this is... Vindicators 3 And you guys did Vindicators 2... w-without us"
3,4,Vindicators 3  The Return of Worldender,Million Ants,I sense... insecurity.
3,4,Vindicators 3  The Return of Worldender,Vance,Are you sure theres not just a picnic nearby.
3,4,Vindicators 3  The Return of Worldender,Rick,"I guess he found his crowd. Pretty toothless stuff, guys."
3,4,Vindicators 3  The Return of Worldender,Rick,"I hope youre happy with the adventure so far, Morty. These guys are even lamer than last time."
3,4,Vindicators 3  The Return of Worldender,Morty,"We werent here last time, remember They did a whole Vindicators without us. A bunch of them got killed, too. They lost Lady Katana, Calypso, Diablo Verde..."
3,4,Vindicators 3  The Return of Worldender,Rick,"Yikes. Yeah, things did feel less diverse in there."
3,4,Vindicators 3  The Return of Worldender,Morty,This article says the reason we werent involved was... personality conflicts.
3,4,Vindicators 3  The Return of Worldender,Rick,"Dont worry, Morty, they love you. Superheroes need a wide-eyed unremarkable to tag along and react to everything like its mind-blowing."
3,4,Vindicators 3  The Return of Worldender,Morty,I... think the personality conflict might have been... you.
3,4,Vindicators 3  The Return of Worldender,Rick,"Jesus... How awesome is that I mean, they wanted to not need me so bad, they murdered three innocent heroes of color, and they still had to bring me back"
3,4,Vindicators 3  The Return of Worldender,Morty,"Rick, since its my adventure and all, could you do me a favor"
3,4,Vindicators 3  The Return of Worldender,Rick,"Uh, the adventure is the favor, Morty. Me sleeping on these linens is the favor. I mean, w-w-w-what--what are we vindicating Comfort"
3,4,Vindicators 3  The Return of Worldender,Morty,"Rick, this really bums me out. It-Its embarrassing to find out these guys dont like us."
3,4,Vindicators 3  The Return of Worldender,Rick,"Why Morty,  I defeat gagoos more powerful than these guys every week."
3,4,Vindicators 3  The Return of Worldender,Morty,"Yeah, but not heroes."
3,4,Vindicators 3  The Return of Worldender,Rick,"Oh, please. They just call themselves heroes so they can..."
3,4,Vindicators 3  The Return of Worldender,Morty,"Im calling them that, Rick Theyre my heroes Mine"
3,4,Vindicators 3  The Return of Worldender,Rick,Huh... no accounting for taste. Im gonna go get a drink.
3,4,Vindicators 3  The Return of Worldender,Morty,"Oh, God."
3,4,Vindicators 3  The Return of Worldender,Supernova,"Good morning. Looks like your grandpa had a long night. Crocubot, why dont you escort Mr. Sanchez to a more comfortable spot so that someone can...  clean up his diarrhea."
3,4,Vindicators 3  The Return of Worldender,Supernova,"Actually, Noob-Noob, you have a new mission."
3,4,Vindicators 3  The Return of Worldender,Supernova,"Vindicators, prepare for arrival."
